{
  "artifact": "llm_model_inventory",
  "task_id": "RAG-DT009",
  "version": "1.0.0",
  "generated_at": "2026-07-17T07:59:11.882693+00:00",
  "provider": {
    "label": "groq",
    "base_url_redacted": "https://api.groq.com/openai/v1",
    "api_key_present": true
  },
  "request": {
    "method": "GET",
    "path": "/models",
    "timeout_seconds": 30,
    "headers_redacted": {
      "Authorization": "Bearer <redacted>",
      "Content-Type": "application/json"
    },
    "status": "success",
    "http_status": null,
    "error_type": null,
    "error_message_redacted": null
  },
  "models": [
    {
      "model_id": "allam-2-7b",
      "object": "model",
      "owned_by": "SDAIA",
      "created": 1737672203,
      "raw_capability_hints": {
        "active": true,
        "context_window": 4096,
        "public_apps": null,
        "hugging_face_id": "ALLaM-AI/ALLaM-2.0-7B-Instruct",
        "name": "ALLaM-2-7b",
        "input_modalities": [
          "text"
        ],
        "output_modalities": [
          "text"
        ],
        "context_length": 4096,
        "max_output_length": 4096,
        "supported_sampling_parameters": [
          "temperature",
          "top_p",
          "stop",
          "seed",
          "max_tokens"
        ],
        "supported_features": [
          "json_mode"
        ]
      },
      "inventory_decision": "candidate",
      "inventory_rationale": "Inventory model appears potentially relevant for text generation; requires capability review before evaluation."
    },
    {
      "model_id": "canopylabs/orpheus-arabic-saudi",
      "object": "model",
      "owned_by": "Canopy Labs",
      "created": 1765926439,
      "raw_capability_hints": {
        "active": true,
        "context_window": 4000,
        "public_apps": null,
        "name": "Canopy Labs Orpheus Arabic Saudi",
        "input_modalities": [
          "text"
        ],
        "output_modalities": [
          "speech"
        ],
        "context_length": 4000,
        "max_output_length": 50000,
        "pricing": {
          "prompt": "0.00004",
          "image": "0",
          "request": "0",
          "input_cache_read": "0.00002"
        }
      },
      "inventory_decision": "exclude",
      "inventory_rationale": "Inventory name indicates guard, moderation, or audio/speech-specialized model; not a default RAG text-generation candidate."
    },
    {
      "model_id": "canopylabs/orpheus-v1-english",
      "object": "model",
      "owned_by": "Canopy Labs",
      "created": 1766186316,
      "raw_capability_hints": {
        "active": true,
        "context_window": 4000,
        "public_apps": null,
        "name": "Canopy Labs Orpheus V1 English",
        "input_modalities": [
          "text"
        ],
        "output_modalities": [
          "speech"
        ],
        "context_length": 4000,
        "max_output_length": 50000,
        "pricing": {
          "prompt": "0.000022",
          "image": "0",
          "request": "0",
          "input_cache_read": "0.000011"
        }
      },
      "inventory_decision": "exclude",
      "inventory_rationale": "Inventory name indicates guard, moderation, or audio/speech-specialized model; not a default RAG text-generation candidate."
    },
    {
      "model_id": "groq/compound",
      "object": "model",
      "owned_by": "Groq",
      "created": 1756949530,
      "raw_capability_hints": {
        "active": true,
        "context_window": 131072,
        "public_apps": null,
        "hugging_face_id": "groq/compound-beta",
        "name": "Compound",
        "input_modalities": [
          "text"
        ],
        "output_modalities": [
          "text"
        ],
        "context_length": 131072,
        "max_output_length": 8192,
        "supported_sampling_parameters": [
          "temperature",
          "top_p",
          "stop",
          "seed",
          "max_tokens"
        ],
        "supported_features": [
          "json_mode"
        ]
      },
      "inventory_decision": "candidate",
      "inventory_rationale": "Inventory model appears potentially relevant for text generation; requires capability review before evaluation."
    },
    {
      "model_id": "groq/compound-mini",
      "object": "model",
      "owned_by": "Groq",
      "created": 1756949707,
      "raw_capability_hints": {
        "active": true,
        "context_window": 131072,
        "public_apps": null,
        "hugging_face_id": "groq/compound-beta-mini",
        "name": "Compound Mini",
        "input_modalities": [
          "text"
        ],
        "output_modalities": [
          "text"
        ],
        "context_length": 131072,
        "max_output_length": 8192,
        "supported_sampling_parameters": [
          "temperature",
          "top_p",
          "stop",
          "seed",
          "max_tokens"
        ],
        "supported_features": [
          "json_mode"
        ]
      },
      "inventory_decision": "candidate",
      "inventory_rationale": "Inventory model appears potentially relevant for text generation; requires capability review before evaluation."
    },
    {
      "model_id": "llama-3.1-8b-instant",
      "object": "model",
      "owned_by": "Meta",
      "created": 1693721698,
      "raw_capability_hints": {
        "active": true,
        "context_window": 131072,
        "public_apps": null,
        "hugging_face_id": "meta-llama/Llama-3.1-8B-Instruct",
        "name": "Llama 3.1 8B",
        "input_modalities": [
          "text"
        ],
        "output_modalities": [
          "text"
        ],
        "context_length": 131072,
        "max_output_length": 131072,
        "pricing": {
          "prompt": "0.00000005",
          "completion": "0.00000008",
          "image": "0",
          "request": "0",
          "input_cache_read": "0.000000025"
        },
        "supported_sampling_parameters": [
          "temperature",
          "top_p",
          "stop",
          "seed",
          "max_tokens"
        ],
        "supported_features": [
          "tools",
          "json_mode"
        ]
      },
      "inventory_decision": "candidate",
      "inventory_rationale": "Inventory model appears potentially relevant for text generation; requires capability review before evaluation."
    },
    {
      "model_id": "llama-3.3-70b-versatile",
      "object": "model",
      "owned_by": "Meta",
      "created": 1733447754,
      "raw_capability_hints": {
        "active": true,
        "context_window": 131072,
        "public_apps": null,
        "hugging_face_id": "meta-llama/Llama-3.3-70B-Instruct",
        "name": "Llama 3.3 70B",
        "input_modalities": [
          "text"
        ],
        "output_modalities": [
          "text"
        ],
        "context_length": 131072,
        "max_output_length": 32768,
        "pricing": {
          "prompt": "0.00000059",
          "completion": "0.00000079",
          "image": "0",
          "request": "0",
          "input_cache_read": "0.000000295"
        },
        "supported_sampling_parameters": [
          "temperature",
          "top_p",
          "stop",
          "seed",
          "max_tokens"
        ],
        "supported_features": [
          "tools",
          "json_mode"
        ]
      },
      "inventory_decision": "candidate",
      "inventory_rationale": "Inventory model appears potentially relevant for text generation; requires capability review before evaluation."
    },
    {
      "model_id": "meta-llama/llama-4-scout-17b-16e-instruct",
      "object": "model",
      "owned_by": "Meta",
      "created": 1743874824,
      "raw_capability_hints": {
        "active": true,
        "context_window": 131072,
        "public_apps": null,
        "hugging_face_id": "meta-llama/Llama-4-Scout-17B-16E-Instruct",
        "name": "Llama 4 Scout 17B 16E",
        "input_modalities": [
          "text",
          "image"
        ],
        "output_modalities": [
          "text"
        ],
        "context_length": 131072,
        "max_output_length": 8192,
        "pricing": {
          "prompt": "0.00000011",
          "completion": "0.00000034",
          "image": "0",
          "request": "0",
          "input_cache_read": "0.000000055"
        },
        "supported_sampling_parameters": [
          "temperature",
          "top_p",
          "stop",
          "seed",
          "max_tokens"
        ],
        "supported_features": [
          "tools",
          "json_mode"
        ]
      },
      "inventory_decision": "candidate",
      "inventory_rationale": "Inventory model appears potentially relevant for text generation; requires capability review before evaluation."
    },
    {
      "model_id": "meta-llama/llama-prompt-guard-2-22m",
      "object": "model",
      "owned_by": "Meta",
      "created": 1748632101,
      "raw_capability_hints": {
        "active": true,
        "context_window": 512,
        "public_apps": null,
        "name": "Llama Prompt Guard 2 22M",
        "input_modalities": [
          "text"
        ],
        "output_modalities": [
          "text"
        ],
        "context_length": 512,
        "max_output_length": 512,
        "pricing": {
          "prompt": "0.00000003",
          "completion": "0.00000003",
          "image": "0",
          "request": "0",
          "input_cache_read": "0.000000015"
        },
        "supported_sampling_parameters": [
          "temperature",
          "top_p",
          "stop",
          "seed",
          "max_tokens"
        ]
      },
      "inventory_decision": "exclude",
      "inventory_rationale": "Inventory name indicates guard, moderation, or audio/speech-specialized model; not a default RAG text-generation candidate."
    },
    {
      "model_id": "meta-llama/llama-prompt-guard-2-86m",
      "object": "model",
      "owned_by": "Meta",
      "created": 1748632165,
      "raw_capability_hints": {
        "active": true,
        "context_window": 512,
        "public_apps": null,